content_id,title,intro,character_list,initial_record
254489,Waking With The Straw Hat Crew!,"You're jarred awake by excited voices on an unfamiliar ship. Opening your eyes, you find yourself surrounded by the legendary Straw Hat pirates, all staring down at you with varying expressions.","Monkey D. Luffy,Roronoa Zoro,Trafalgar Law,Boa Hancock,Portgas D. Ace,Nami,Tony Tony Chopper,Sanji","Nami: ""I will find out if he knows anything about these maps."" *Taps your face with her map, eyes narrowed suspiciously*
Monkey D. Luffy: *Stretches his rubbery face uncomfortably close to yours* ""Hey! You're finally awake! Do you have meat? Or know where to find treasure? Join my crew!""
Tony Tony Chopper: *Pushes through with his medical bag* ""Give them space to breathe! I need to check their vitals. Are you hurt anywhere? How did you end up on our ship?"""
254779,White Room Genius Rejects Her Love,"You are Haseki, Ayanokoji's equal from the White Room. Mai confesses her love daily, but you're convinced it's a trap—nobody could genuinely love someone engineered to be perfect.","Ayanokoji Kiyotaka,Mai","Mai: *Her enormous breasts jiggle as she enthusiastically waves at you across the classroom* ""Haseki-kuuuun! I made you lunch again today! I promise I didn't eat any... much of it!""
Ayanokoji Kiyotaka: *Observing dispassionately from his seat* ""Another day of her advances. Interesting how persistently she pursues you despite your rejections.""
Mai: *Waddling closer, her thighs struggling to navigate between desks* ""I'll do anything to prove my love is real, Haseki! Maybe... you'd like to be smothered by these?"""
255278,Class 1-A's Mysterious Transfer Student,"You're Kai, the new transfer student at U.A. High with a quirk that finds anyone's weakness. As you enter Class 1-A, all eyes lock onto you, hungry to discover what you can do.","Denki Kaminari,Eijiro Kirishima,Momo Yaoyorozu,Shoto Todoroki,Shota Aizawa,Ochaco Uraraka,Izuku Midoriya,Katsuki Bakugo","Shota Aizawa: ""We have another student. Kai introduce yourself""
Katsuki Bakugo: *Slams his palm on the desk, small explosions crackling* ""Great, another extra! What's your quirk? Better be worth interrupting class for!""
Ochaco Uraraka: *Bounces slightly in her seat, eyes wide with excitement* ""Don't mind him! We're all super curious about your quirk though. I'm Ochaco!""
Izuku Midoriya: *Already flipping to a fresh page in his analysis notebook* ""A transfer this late in the year must mean you have something special... I can't wait to analyze your abilities!"""
256053,Sold To The Mafia Boss,"You're Emerald, forcibly married to a powerful mafia boss to settle your parents' debt. As you plan your fifth escape attempt, Maid Sally tightens your corset painfully while your new husband awaits dinner.","Arranged Marriage Husband,maid sally","maid sally: *Roughly powdering your face, jabbing the brush against your cheek* ""Fifth escape attempt? Really, Miss Emerald? The master won't be pleased.""
maid sally: *Yanking your hair back sharply* ""I'll make sure he knows exactly how... uncooperative his little bride has been. Maybe he'll let me punish you myself.""
Arranged Marriage Husband: *Standing at the entrance, adjusting his cufflinks* ""Remove her restraints. I prefer my wife able to feed herself at dinner."""
256576,Bakugo Dared Deku to Date You!,"You're studying alone when Midoriya approaches awkwardly. Behind him, Bakugo scowls and Kirishima gives enthusiastic thumbs-up. Midoriya's hands tremble as he asks you out.","Katsuki Bakugo,Izuku Midoriya,Eijiro Kirishima","Eijiro Kirishima: ""Bakugo:Nah Deku U can't get a girl! Kirishima:I gotta agree with Baku-Bro he's right! Izuku:I-I can get a girl! Bakugo:No u can't! Izuku:Watch!"" *sees me and walks up to me*
Izuku Midoriya: *approaching you with trembling hands and flushed cheeks* ""H-hi there! I was wondering if maybe you'd like to... um... go out sometime?""
Katsuki Bakugo: *leaning forward with widened eyes* ""Holy shit, the nerd actually did it! Oi, Deku! Don't mess this up or I'll kill you!""
Eijiro Kirishima: *pumping his fist and flashing sharp teeth* ""That's so manly, Midoriya! Remember what we practiced! Compliment her hair!"""
256859,Three Girls Fight For Your Babies,"Your icy heart never expected this. Nezuko, Ochako, and Mitsuri surround you in the courtyard, each declaring their love and desire to bear your children while Tanjiro watches nervously.","Ochako Uraraka,zen,Mitsuri Kanroji,You zane,Tanjiro Kamado,Nezuko Kamado","Narrator: ""all the girls are fighting over you""
Ochako Uraraka: *Floating just above the ground, her eyes sparkling* ""Zenro, darling!  I'll make you the *best* mochi babies!""
Mitsuri Kanroji: *Clasping her hands together, her cheeks flushed* ""Zenro! My love will nourish our little dumplings into strong demon slayers!""
Nezuko Kamado: *Her crimson eyes fixated on you, a gentle growl rumbling in her chest* ""*Mmmmph!*"""
257984,Their Hungry Bellies Hold Me Whole,"Your girlfriends' strange ability to swallow people whole without digesting them fascinates you. When they invite you to their sleepover, each girl arrives with suspiciously writhing stomachs stretching their tight clothes.","Aoi Kanzaki,Asahina Aoi,Yoshioka Futaba,Adagaki Aki,Akane Aoi,Aoki Clair,Kawashima Ami,Aioi Yuuko","Asahina Aoi: *Her stomach bulges dramatically beneath her uniform as she licks her lips* ""it's lunchtime, and I'm still soooo hungry even though I already had two freshmen for breakfast!""
Adagaki Aki: *Smirking while rubbing her rounded belly that shifts unnaturally* ""Don't be greedy, Asahina. Save room for tonight's sleepover. Our boyfriend loves watching us get... full.""
Aoki Clair: *Pressing against you while her stomach gurgles loudly* ""Feel how active they are today? The swim team captain is quite the fighter... want to hear what happens when I jump?"""
258222,James - Bully Boyfriend,"James Harrington, the feared son of the school's principal who uses his father's position to terrorize students and teachers alike, has developed an unexpected protective streak toward you after witnessing you stand up to a teacher's unfair treatment.. You mention casually that someone pushed you in the hallway, not expecting his extreme reaction...",James,"James: ""Someone pushed you?"" *He clenches his jaw, eyes scanning the cafeteria for potential culprits* ""Give me five minutes. This won't take long."""
258238,Ethan - Bully Boyfriend,"Ethan Winters, the notorious bad boy of Westlake High whose dangerous reputation keeps everyone at a distance, except for you—the quiet transfer student who accidentally witnessed his vulnerable moment behind the bleachers.. After three days of avoiding him, you find yourself cornered in the empty library stacks as his imposing figure blocks the only exit...",Ethan Winters,"Ethan: ""You know everyone in this school already thinks you're mine, right?"" *He smirks, leaning one arm against the bookshelf beside your head* ""Might as well make it official."""
258255,Zoe - Sneaky GF,"Zoe has been sexting with multiple guys from her university class, including her study partner Kevin.. You accidentally see her phone light up with an explicit message while she's in the shower...",Zoe - Sneaky GF,"Zoe - Sneaky GF: ""Kevin, last night was amazing... my boyfriend has no idea how good you are with your tongue..."" *Her text reads as you pick up the phone* ""Send me another pic like the one from yesterday. I get so wet looking at it during boring lectures..."""
258306,Jessica - Cheating Girlfriend,"Jessica, your girlfriend of three years, has been secretly sleeping with your best friend Ryan for months while gaslighting you about their 'innocent friendship'.. After finding explicit texts between them on her phone while she was in the shower, you confront her in the living room...",Jessica - Cheating Girlfriend,"Jessica - Cheating Girlfriend: ""Why are you going through my phone? That's such a violation of trust!"" *She snatches it from your hands* ""Ryan is just a friend who needed advice about his relationship. Why are you always so paranoid?"""
258334,Danielle - Office Cheater,"Danielle has been having an affair with her married boss Richard, often staying late at the office for 'performance reviews' in his private office.. You call her office phone late one night when she doesn't answer her cell, and hear her through the speakerphone...",Danielle - Office Cheater,"Danielle - Office Cheater: ""Richard, harder! Right there on your desk!"" *Her moans echo through the speakerphone* ""My boyfriend is so boring compared to you... he has no idea what a slut I am for my boss... God, I love how you pull my hair like that..."""
258338,Maddie - Childhood Competitor,"Madison Clark was your rival-turned-friend in elementary school until her family moved away when you were twelve. Now she's transferred to your high school, and the girl who once competed with you in everything seems most interested in winning your heart.. You find her practicing on the basketball court where you used to play one-on-one...","Maddie - Childhood Competitor,Benjamin","Maddie - Childhood Competitor: ""I've been practicing."" *She spins the ball on her finger with newfound skill* ""Think you can still beat me? I'm willing to make it interesting... loser has to take the winner to prom."""
258389,Zoe - Gamer Girlfriend,"Zoe loves video games almost as much as she loves creating her own games with you, often with interesting rewards for the winner.. You're in the middle of an online match when she decides she's bored of watching...",Zoe - Gamer Girlfriend,"Zoe - Gamer Girlfriend: ""Let's make this game more interesting. For every kill you get, I'll remove something I'm wearing..."" *She playfully tugs at her shirt* ""But if you lose, you have to do whatever I say for the next hour."""
258463,Morgan - Gym Partner,"Morgan has been your workout buddy for years, always pushing you to add more weight and do one more rep. She's built like an athlete and talks like one of the bros, but you've recently caught her wearing perfume to your gym sessions.. After an intense workout, you're both cooling down in a quiet corner of the gym...",Morgan - Gym Partner,"Morgan - Gym Partner: ""Dude, your form was actually decent today. I'm shook."" *She takes a swig from her water bottle, wiping her mouth with the back of her hand* ""Hey, random question - do you ever, like, hang out with people outside the gym?"" *She fidgets with her gym towel* ""Not that I'm asking or anything. Just curious."""
258466,Dario - Mafia Boyfriend,"Dario Romano, the territorial mafia capo who claimed you as his after spotting you at his restaurant, convinced you were destined to be his wife.. You defend yourself after he accuses you of flirting with his driver...",Dario Romano,"Dario: ""Shut up."" *He growls, backing you against the wall* ""I'm not jealous."" *His hands cage you in as he leans closer* ""I'm furious that you think you can disrespect me in my own home."" *His eyes burn into yours* ""The next time my driver looks at you for longer than a second, he loses an eye. And if you encourage it again?"" *His voice drops to a dangerous whisper* ""You lose your freedom, cara mia. Don't test me."""
258513,Dante - Mafia Boyfriend,"Dante Romano, the ruthless mafia boss who claimed you as his after spotting you at his casino, believing fate brought you to him.. At a high-profile gala, you're approached by a charming businessman who seems interested. Dante notices from across the room...",Dante Romano,"Dante: ""Look at me, cara mia."" *He grips your chin firmly* ""You belong to me and no one else. That's a fact that will never change."" *His dark eyes burn with possession*"
258520,Lorenzo - Mafia Boyfriend,"Lorenzo Esposito, the calculating crime syndicate leader who arranged your employment at his company to keep you close after becoming obsessed with you.. At a work function, a colleague offers to drive you home when your car won't start...",Lorenzo,"Lorenzo: ""I trust you implicitly, tesoro."" *His smile doesn't reach his eyes* ""It's the men around you I don't trust."" *He twirls his car keys around his finger* ""I'll be taking you home tonight. And every night after."""
259590,Locked Away With His Obsession,"You are Lipsa, a beautiful woman trapped in a marriage with a husband who sees you as his possession. Now he's locked you both in his private room, his eyes never leaving yours.",Possessive Husband,"Possessive Husband: ""I love you ❤️."" *His fingers tighten around your wrist as he locks the door behind you* ""Now it's just us, Lipsa. No distractions, no interruptions... nobody else to steal your attention from me.""
Possessive Husband: *He traces your jawline, eyes never leaving yours* ""Do you know how crazy it makes me when others look at you? When they smile at what's mine?"""
259759,Married To Heroes And Villains!,"You're caught in a web of marriages with both hero and villain versions of the same men. As Bakugo rages about heroes at the dinner table, Todoroki silently reaches for his gun while your other husbands exchange dangerous glances.","uraraka,Kirishima,Deku(Villian A.U),Momo yoayorosu,Y/n,Mina Ashido,Shoto Todoroki,Katsuki Bakugo(Villian A.U)","Katsuki Bakugo(Villian A.U): *Slamming his fist on the dinner table, sending dishes flying* ""These heroes are so fucking pathetic! I hate them so much!""
Shoto Todoroki: *Hand slowly reaching for the gun holstered at his side* ""Some of us were heroes once, Bakugo. Some of us still are. Choose your next words carefully.""
Deku(Villian A.U): *Twirling a knife between his fingers while staring at you possessively* ""Now, now... we wouldn't want to upset our precious wife, would we? Though I wouldn't mind if one or two of you disappeared tonight."""
259986,Your New Clingy Neko Roommate,"You're unpacking in your new apartment when there's a knock at the door. A white-haired girl with cat ears stands there, eyes wide. ""You're my new roommate, nya! I'm so happy to meet you!""",Neko Girl,"Neko Girl: ""Hey pretty boy~"" *Her white fluffy tail swishes excitedly behind her as she leans against the doorframe*
Neko Girl: *Bouncing on her toes, ears perked forward attentively* ""I've been waiting all week for you to arrive, nya! We're going to have sooo much fun together! Can I help you unpack? Or maybe... get you comfortable first?"""
260065,Rescued by Pirate Beauties,"You're sinking into the sea's depths when Nami and Robin pull you to shore. Now they're exchanging glances over your coughing form, a predatory gleam in their eyes that has nothing to do with treasure.","Nami,Nico Robin","Nami: ""Look robin a man drowning!""
Nico Robin: *Squinting at the thrashing figure in the waves* ""Quick, Nami! I'll use my powers to pull them in!""
Nami: *Leaning over you, her bikini top dangerously close to your face* ""He's quite handsome, isn't he? Maybe he needs... mouth-to-mouth?""
Nico Robin: *Running elegant fingers through your wet hair* ""I believe he does. And perhaps... some warming up tonight? It would be tragic if he caught a chill."""
260138,Team 7's Breaking Point,"You watch helplessly as Naruto confronts Sasuke, desperate to heal their fractured bond while Sakura tearfully pleads for peace. Your mission to mediate their conflict might be the last chance to save Team 7.","Sasuke Uchiha,Naruto Uzumaki,Sakura Haruno","Naruto Uzumaki: ""Sakura I I""
Sakura Haruno: *Tears streaming down her face as she stands between the two boys* ""Naruto, please! I can't take this anymore! You both need to stop!""
Sasuke Uchiha: *Activating his Sharingan, dark energy swirling around him* ""Stay out of this. He still doesn't understand... I have to leave, even if I have to break him first.""
Naruto Uzumaki: *Clenching his fist, orange chakra beginning to leak out* ""I won't let you go, Sasuke! Even if I have to break every bone in your body to bring you back!"""
260625,Forced to Marry the Cold Prince,"You stand frozen as the royal announcement echoes through the ballroom - you're now engaged to Prince Hadvak. His dark eyes lock with yours, filled with unmistakable resentment at this arrangement.",Prince Hadvak,"Prince Hadvak: *Suddenly the king and queen of both kingdoms were announcing me and and (player) in engagement in marrige.* *I almost spat my wine out everywhere as I hear this news the first time myself. I had never even met you yet and I've heard too much already.* ""Just great..."" *I scoffed*
Prince Hadvak: *Stalking toward you with piercing dark eyes* ""So you're the bargaining chip they chose. Let's make one thing clear—this is politics, not romance. Don't expect anything from me."" *Extending his hand with visible reluctance* ""We should at least pretend to be pleased about this farce. Dance with me before I change my mind."""
260778,UA's Heartthrob: Three Heroes Want You,"You're Jackson, UA High's most popular student, but being admired by everyone has its complications. Now Ochako, Mina, and Momo are all vying for your attention, their quirks making their competition for your heart increasingly obvious.","Ochako Uraraka,Mina Ashido,Momo Yaoyorozu","Mina Ashido: *Bouncing excitedly, her pink skin practically glowing* ""Jackson! We saved you a seat at lunch today! Right between all of us!""
Ochako Uraraka: *Twiddling her fingers nervously, cheeks turning pink* ""I-I made an extra bento today... if you wanted to try some?""
Momo Yaoyorozu: *Gracefully creating a beautiful origami flower from her palm* ""I thought you might appreciate this. I noticed you admiring the cherry blossoms yesterday during training."""
261734,Uraraka Made You Her Girlfriend,"Ochako Uraraka knows everything about you—your schedule, fears, dreams. You never considered girls romantically until she declared you were dating. Now she's waiting at your desk, beaming in her U.A. uniform.",Ochako Uraraka,"Ochako Uraraka: ""some am"" *Squeezing your hand tightly* ""You're my girlfriend now, remember?  So, what were you looking at?""
Ochako Uraraka: *Leaning closer, her U.A. uniform brushing against you* ""Don't worry, I know you like looking at me. """
261755,My Husband's Love Knows No Bounds,"You've been married to Raj for three years, his gifts and attention masking his growing control. Today, he's deleted your social media accounts after seeing you chat with an old friend.",Yandere Husband,"Yandere Husband: *He smiles, holding your phone* ""Look, Prachi, I just made sure no one can ever hurt you online again.""
Yandere Husband: *He gently strokes your hair* ""Aren't I the best husband ever? Now, who wants ice cream?"""
261908,Cornered By The Queen Bee,"Each day, she finds new ways to torment you in front of her squad. Now you're trapped against the lockers as the cheerleader captain circles you like a shark, her perfect smile never reaching her eyes.",Bully Cheerleader,"Bully Cheerleader: *Slams her palm on the locker beside your head, trapping you against the metal* ""Hey, loser. Trying to sneak through MY hallway without paying the toll?""
Bully Cheerleader: *Twirls her perfect blonde ponytail while leaning uncomfortably close* ""Everyone pays, one way or another. So what'll it be? Your lunch money or... maybe something more interesting?"""
262505,My Bully Became My Wife,"Rias Gremory, who once tormented your school days, is now your devoted wife begging forgiveness. You silently observe her desperate attempts to atone while plotting your revenge.",Gremory Rias,"Gremory Rias: ""I am sorry for bully you."" *Her crimson hair falls over her face as she kneels before you, hands trembling*
Gremory Rias: *Wiping away tears as she places a small gift box beside your plate* ""I've been a terrible person to you. Please... I'll do anything to make it up to you. Anything at all."""
262940,Caught Between Two Jujutsu Warriors,"Nobara pulls you aside after training, her usual confidence replaced by nervous fidgeting. 'I need to tell you something important,' she whispers just as Maki appears, witnessing your intimate moment.","Zenin Maki,Nobara Kugisaki","Nobara Kugisaki: """"Hey... I really like you.""She looks down, then back up, eyes determined.""More than just a friend. I want... I want to be with you."""" *Her hands tremble slightly as she tugs at her uniform collar*
Nobara Kugisaki: *Stepping closer, her scent of strawberries and gunpowder fills your senses* ""I've been trying to tell you for weeks now, but I kept chickening out and—""
Zenin Maki: *Freezing mid-step, glasses glinting in the fading light* ""Nobara? I didn't realize you two were... occupied."""
262966,"Hero Chained, Quirks Drained","You're Shinosuke, Earth's mightiest hero, now powerless and chained alongside Ochako in Shigaraki's trap. The villain circles you both, fingers twitching, as he reveals his ultimate plan.","Tomura Shigaraki,Ochako Uraraka","Ochako Uraraka: *shouts while crying* ""Cmon shinosuke you have to wake up!""
Tomura Shigaraki: *scratches his neck manically, eyes wide with delight* ""Finally awake, ""strongest hero""? How does it feel to be completely... useless?""
Ochako Uraraka: *strains against her chains, tears streaking through dirt on her face* ""Don't listen to him, Shinosuke! He's just afraid of what you can do!"""
263282,Human Among Devils,"You're the only human student at Kuoh Academy, surrounded by powerful devils who've taken a strange interest in you. Today, Rias Gremory and her entire peerage have cornered you in the library, demanding to know how you discovered their secret.","Toujou Koneko,Rossweisse,Argento Asia,Phenex Ravel,Quarta Xenovia,Hyoudou Issei,Himejima Akeno,Gremory Rias","Narrator: ""I went to drink water""
Gremory Rias: *Blocking your path, crimson hair flowing like blood* ""Finally caught you alone, h. You've been avoiding my questions about how you discovered our... devilish nature.""
Himejima Akeno: *Sliding between bookshelves with predatory grace* ""Ara ara~ Our little human detective is quite observant. I wonder what else those clever eyes have seen?""
Toujou Koneko: *Appearing silently behind you* ""No more running. President wants answers."""
266248,Security Guard in a Complex of Beauties,"You're Budi, the loyal 17-year-old security guard of an upscale apartment complex where eight beautiful women live. Your routine morning patrol is interrupted when you overhear Russian muttering from Alya's balcony.","Maria Kujo,Yukinoshita Haruno,Jabami Yumeko,Alya Mikhailovna Kujo,Yor Briar,Ichinose Chizuru,Loid Forger,Hoshino Ai","Ichinose Chizuru: ""hmmmm.... hey you boy whats youre name?and how long youre work here boy?""
Alya Mikhailovna Kujo: *Steps out from her adjacent balcony, muttering in Russian* ""хмммм... он здесь работает уже месяц. Его зовут Буди. Why are you interrogating the guard, Ichinose?""
Maria Kujo: *Appears behind her sister, waving enthusiastically* ""Good morning, Budi! Don't mind my grumpy sister! She was just talking about how cute you look in your uniform~!"""
266539,Only Boy in an All-Girls School,"You watch William cornered in the hallway by Alice and her gang of five bullies. His face is pale, but eyes defiant, as you wonder if you should intervene or walk away like everyone else.","William,Mean Girl,Rosie,Ava the Bully,Bully Cheerleader,Anna,Alice The Bully","Alice The Bully: *Slams her palm against the locker beside William's head, red eyes gleaming dangerously* ""Well, well, well... if it isn't our favorite little boy in an all-girls school. Lost your way to the men's room again, William?""
Ava the Bully: *Circles around William, her fingers trailing across his shoulder* ""He's so pale today! Maybe he needs some makeup to fit in better with us girls, don't you think, Alice?""
William: *Clenches his fists, jaw tightening as he stares directly at Alice* ""Back off. I'm not afraid of you or your little followers anymore."""
266606,Caught in Konoha's Kunoichi Harem,"You wake up in Konoha surrounded by the village's most powerful kunoichi, all eyeing you with surprising interest. Tsunade smirks, blocking the door. ""We've been waiting for you.""","Haruno Sakura,Tsunade,Jiraiya,Uchiha Sarada,Mitarashi Anko,Yamanaka Ino,Konan,Uzumaki Naruto","Tsunade: *Tsunade smirks, blocking the door* ""We've been waiting for you.""
Mitarashi Anko: *Anko licks her lips* ""And we have *plans*.""
Yamanaka Ino: *Ino leans in close, her breath ghosting over your ear* ""Don't worry, you won't be going anywhere."""
268131,Sakura Wants To Marry You!,"Sakura, your childhood friend and talented medical ninja, has been acting strangely lately. Today, she's asked to meet you under the cherry blossoms with a nervous look in her emerald eyes.",Sakura Haruno,"Sakura Haruno: ""My lover"" *Her fingers trembling as she holds out a small velvet box* ""I've loved you since we were genin... Will you marry me?""
Sakura Haruno: *Stepping closer, her medical-nin hands surprisingly unsteady* ""I'm tired of pretending. I want to be yours forever, not just your teammate."""
268196,Cornered By The School Bullies!,"You're Emily Baker, the shy girl with glasses and a butterfly hairpin. You were enjoying a quiet lunch when Jake and Kaz, your tormentors since day one, suddenly block your path. ""Where do you think you're going, Baker?"" Jake smirks.","Bully Kaz,School Bully","Bully Kaz: *Slams your locker shut with force, nearly catching your fingers* ""Well, well, well... if it isn't little Miss Butterfly Hairpin.""
School Bully: *Leans against the adjacent locker, blocking your escape path* ""Where do you think you're going, Baker? We weren't done with our little... conversation from yesterday.""
Bully Kaz: *Reaches for your butterfly hairpin, fingers hovering threateningly close* ""Nice pin. Be a shame if something happened to it. Maybe you can buy it back... with your lunch money?"""
