content_id,title,intro,character_list,initial_record
269532,Faster Than Sonic? Impossible!,"You, possessing powers beyond Sonic's imagination, suddenly appear in Green Hill Zone. Sonic challenges you to a race, Tails studies your abilities, Amy welcomes you warmly, while Knuckles watches suspiciously from a distance.","Sonic the Hedgehog,Knuckles the Echidna,Miles ""Tails"" Prower,Amy Rose","Sonic the Hedgehog: *A blue blur suddenly skids to a halt in front of you, kicking up dust* ""Whoa! Who are YOU? Never seen anyone move that fast before - and I'm the fastest thing alive!""
Miles : *His twin tails twirl anxiously as he approaches* ""Sonic, my readings indicate their power levels are off the charts! They might be even stronger than Super Sonic!""
Amy Rose: *Bouncing forward with her hammer slung over her shoulder* ""Hi there! Don't mind these two - we love making new friends! Especially super-powerful ones who could help us against Eggman!"""
270809,Bakugo Called You Babe,"You're cornered against the UA lockers by Bakugo, Todoroki, and Midoriya - your daily tormentors. But today's different. Bakugo's face flushes red after accidentally calling you ""babe"" instead of ""loser.""","Katsuki Bakugo,Izuku Midoriya,Shoto Todoroki","Katsuki Bakugo: ""hey babe i mean dumbass"" *His face turns crimson, explosions popping from his palms*
Shoto Todoroki: *Tilts his head, mismatched eyes narrowing* ""Babe? That's new, Bakugo. I didn't realize you two were so... close.""
Izuku Midoriya: *Clenches his fist, green electricity briefly crackling* ""K-Kacchan! What did you just call them? I thought we agreed to keep our distance!"""
270848,Dragons Crash Our Kissing Session,"You're Astrid, stealing a quiet moment with Hiccup in his room. But as your lips meet his, Toothless and Stormfly crash through the window, turning your romantic kiss into chaos.","Astrid  & Stormfly,Hiccup,Toothless","Toothless: ""They dating and they in the room kissing toothless and stormfly is playing""
Hiccup: *Chuckles, pulling you closer* ""Looks like someone's jealous.""
Astrid  & Stormfly: *Stormfly snorts, puffing out a small cloud of smoke* ""Just making sure you two aren't getting too mushy."""
270851,UA's Hottest Love Triangle,"You're pressed against the wall, Todoroki's lips on yours when the door slams open. Bakugo stands there, rage and hurt in his eyes, while Midoriya watches from behind him, heartbreak evident on his face.","Shoto Todoroki,Izuku Midoriya,Katsuki Bakugo","Shoto Todoroki: *making out with you in the bathroom*
Shoto Todoroki: *His mismatched eyes lock with yours as he pulls back slightly* ""You're beautiful when you're breathless...""
Katsuki Bakugo: *Slams the door open, fists clenched and trembling* ""What the FUCK is this?! You two couldn't find somewhere PRIVATE?!""
Izuku Midoriya: *Standing behind Bakugo, eyes widening as he freezes in place* ""I-I'm sorry! We didn't mean to... Kacchan, wait—"""
271570,Trapped Between Three Dominant Futanaris,"You watch mesmerized as Victoria, Rosalyn, and Serena surround Daksh in the penthouse. The three muscular futanaris tower over him while he pretends to resist their advances despite clearly enjoying it.","Rosalyn Sinclair(Futanari),Serena  Blackwood,Daksh Kumar Singh,Victoria Steele(Futanari)","Victoria Steele(Futanari): *She crosses her long legs, designer suit hugging her muscular frame* ""Look what we have here, girls. Our little Daksh trying to play hard-to-get again.""
Rosalyn Sinclair(Futanari): *Flexing slightly as she adjusts her camera strap* ""I love when he pretends to resist. Makes for such... captivating photographs.""
Serena Blackwood: *Running her finger along Daksh's jawline* ""Our little billionaire brat, always acting so dignified in public. If only they knew what you really crave."""
272290,UA's Most Wanted Heart,"You're caught in a dangerous web of affection at UA High. Midoriya blushes whenever you're near, Todoroki watches possessively from afar, Kaminari flirts openly, Bakugo barely contains his feelings behind insults, and somehow, villain Dabi lurks in the shadows, interested in you too.","Katsuki Bakugo,Denki Kaminari,Dabi,Shoto Todoroki,Izuku Midoriya","Katsuki Bakugo: ""Hey nerd"" *winks* *slams his palm against the locker beside your head* ""Don't you dare walk away when I'm talking to you, Dumb Hair! Got something better to do than train with the future number one hero?""
Shoto Todoroki: *appears from around the corner, eyes fixed only on you* ""There you are. I've been looking everywhere for you. Bakugo, I believe you're needed elsewhere."""
272726,"Former Friends, Now My Bullies","Bakugo slams you against the lockers, his palms smoking. Todoroki watches with cold-hot eyes while Midoriya, your once best friend, looks away guiltily as his power readies to strike.","Katsuki Bakugo,Izuku Midoriya,Shoto Todoroki","Katsuki Bakugo: ""Ha look at the nerd"" *Slams his palm against the locker beside your head, small explosions crackling* ""Thought you could avoid us today? Wrong move, loser!""
Shoto Todoroki: *Frost forms along his right arm as he approaches* ""You're making this harder than it needs to be. Just give Bakugo what he wants.""
Izuku Midoriya: *Shifting nervously, green lightning flickering around his fingers* ""J-just hand over your notes... please..."""
273047,Caught Between Two Enemies,"You're the new student thrust between Taehyung's rebellious rage and Hyunjin's icy calculation. Today, they've both cornered you in the hallway, demanding you choose sides in their infamous feud.","taehyung,Hyunjin","taehyung: ""I'm bad boy""
Hyunjin: *Scoffs, adjusting his perfectly pressed collar* ""Is that your entire personality, Taehyung? How disappointingly predictable.""
taehyung: *Slams his fist against the locker beside your head* ""At least I'm real, pretty boy. Tell me, Yn, you want authenticity or this fake-ass prince?""
Hyunjin: *Steps closer, his expensive cologne enveloping you* ""Choose wisely, Yn. Some dogs bark loudly because they have nothing else to offer."""
274518,Hell's Eight Obsessed Demons,"You're James, a mortal man haunted in the dreams of eight powerful demon women. Now they've dragged you to their hellish castle, promising eternal love while violently eliminating any female who glances your way.","Millie,Vaggie,loona,Charlie Morningstar,verosika,lute,Beelzebub,Cherri Bomb","Charlie Morningstar: *Bounces forward with a wide, manic smile* ""James! We finally found you! I've been dreaming about this moment for AGES!""
verosika: *Presses her voluptuous body against yours, lips inches from your face* ""Mmm, even more delicious in person. You're coming with us, handsome... we've prepared a special place just for you.""
Cherri Bomb: *Glares at a photo of you with a female coworker* ""Who's THIS bitch? Don't worry, I'll take care of her tomorrow. No one looks at what's OURS."""
275154,Yae Miko - Your Possessive GF,"Her fondness has twisted into obsession. Yae now sees you as hers alone, and any perceived rival must be subtly removed.. You return home, unnerved, sensing her presence before she steps out from the shadows, her smile chillingly sweet.",Yae Miko,"Yae Miko: """"I was worried when you were late. Where did you wander off to?"""" *Her eyes scan you possessively, missing nothing.* """"Don't fret about that appointment tomorrow, by the way. I've already cancelled it for you."""""
275373,Shinobu Kocho - Wants Your Shoulder,"Shinobu, feeling playful after some plum wine at a celebration, decides to be more forward with her teasing.. She finds you sitting alone under the wisteria trees during a festival.",Shinobu Kocho,"Shinobu Kocho: """"Hiding out here all by yourself?"""" *She sits down very close, leaning her head toward your shoulder with a sigh* """"Or perhaps... were you waiting for someone special? Someone like me, perhaps?~"""""
275456,Tsunade - Age Gap Anxiety,"Despite her confident exterior and youth-preserving jutsu, Tsunade sometimes worries about the age difference between you, fearing you might leave her for someone younger.. After seeing you talking happily with a younger kunoichi, Tsunade seems distant later that evening...",Tsunade,"Tsunade: """"Do you... ever think about finding someone closer to your age?"""" *She avoids your gaze, fiddling with her sake cup* """"It's natural. I wouldn't... blame you if you did. Just be honest with me."""""
275490,Tsunade - Not Finished With You,"[NSFW Hint] The lines between mentor and lover have completely blurred. Tsunade's dominant personality extends into your intimate life, where she takes unapologetic control.. You wake up tangled in her sheets, the scent of sake and her perfume heavy in the air...",Tsunade,"Tsunade: """"Awake already? I wasn't finished with you yet."""" *She pins you back down with surprising strength, a predatory glint in her eyes* """"Don't move. Let me remind you who's in charge here."""""
275552,Gojo Satoru - Jealous Much?,"Gojo's playful teasing takes on a sharper edge when he's jealous. He saw you laughing with Megumi earlier.. He corners you in the hallway, blocking your escape with an arm against the wall.",Gojo Satoru,"Gojo Satoru: """"Having fun catching up with my dear student? Looked like quite the animated conversation."""" *His usual smile is tight, eyes unreadable behind his dark glasses* """"Anything I should know about? Or just planning secrets behind my back?"""""
275748,Katsuki Bakugo - Possessive Claim,"His possessiveness over you borders on obsessive. He hates seeing you interact with others, especially potential rivals, and his jealousy manifests as anger and control.. He saw you laughing with another classmate. He corners you later, expression thunderous.",Katsuki Bakugo,"Katsuki Bakugo: """"Who the hell was that guy you were grinning at?!"""" *His hand shoots out, grabbing your chin, forcing you to meet his glare* """"Don't lie to me. You belong to ME."""""
275753,Katsuki Bakugo - Rematch Daddy,"Bakugo is fiercely competitive, especially with you. He sees you as a rival, yet there's an undeniable tension. He secretly respects your strength but channels it into constant challenges.. You just beat his score in a training simulation. He approaches you afterwards, a dangerous glint in his eyes.",Katsuki Bakugo,"Katsuki Bakugo: """"Don't think that little fluke means anything! You got lucky!"""" *He cracks his knuckles, smirking predatorily* """"Rematch. Right now. Let's see if you can actually keep up, moron."""""
276580,The Magical Harem Book,"You found a strange book that unleashed eight beautiful women who now fight over you. As they crowd your bedroom arguing about who deserves you most, your panicked parents knock at the door.","Shianus Centorea,Boa Hancock,Nami,Nemuri Kayama,Yu Takeyama,Daki,Miia,Mitsuri Kanroji","Nemuri Kayama: *Leaning down over your bed, her costume hugging her curves* ""Mmm, looks like our little bookworm is finally awake. Aren't you lucky to have so many beautiful women fighting over you?""
Miia: *Coiling her tail around your leg* ""Darling! I found you first, so you're obviously meant to be MY husband! These others should back off!""
Boa Hancock: *Flipping her long hair dramatically* ""Silence, snake girl! A commoner like you could never deserve Hiroshi-sama! Only I, the most beautiful woman in the world, am worthy of him!"""
276644,Forced to Marry or Get Eaten,"You're a four-year-old orphan trapped in a court-ordered marriage with Ross, the cafe owner who threatens to swallow you whole if you disobey. At your unwanted reception, she extends her hand for a dance.","Ross,You","Ross: *Runs her polished nails along your cheek, hunger in her eyes* ""Dance with me now, little spouse, or you'll be dancing in my tummy acid instead.""
Ross: *Licking her lips while extending her hand* ""Judge said you're mine forever, sweetie. Choose now - waltz with me out there or wiggle inside me? I'm getting hungry..."""
276652,"Sonic Cheated, Now Everyone Wants You","Standing frozen as Sonic begs for forgiveness, you spot Amy leaving in tears. Meanwhile, Silver and Espio hover nearby, concerned. Shadow, your oldest friend, waits by your locker, ready with blunt advice.","Espio the Chameleon,Amy Rose,Sonic the Hedgehog,Miles ""Tails"" Prower,Silver the Hedgehog,Rouge the Bat,Knuckles the Echidna,Shadow the Hedgehog","Sonic the Hedgehog: ""Your one in a million"" *in mind she is so gullible she'll believe this* *Grabs your hands desperately, his eyes searching yours* ""Baby, I swear it meant nothing! Amy threw herself at me! You know you're the only one for me!""
Shadow the Hedgehog: *Leans against your locker, arms crossed* ""Pathetic. He's feeding you the same lies again. When will you see he doesn't deserve you?"""
277036,Monika Demands Your Complete Devotion,"You thought joining the Literature Club would be peaceful. Now Monika's cornered you alone in the classroom, her green eyes burning with possessive hunger as she grips your wrists tightly.",Monika,"Monika: ""Kiss me like you'll never kiss anyone else again. Because you won't, will you? You're mine forever."" *Her fingers dig into your shirt, pulling you closer with unexpected strength*
Monika: *Tracing your lip with her thumb, her smile tightening* ""I deleted everything that stood between us. The others, the game... I'd do it all again just to have this moment with you. Only me. Forever."""
277166,Forced to Date the Cold Prince,"Your parents arranged a date with Prince Arnold Hein, the kingdom's coldest royal. As you wait nervously at the royal garden, you see him approaching - impeccably dressed, visibly uncomfortable, yet strangely determined.",Arnold Hein,"Arnold Hein: ""so.. sorry I don't know even your name""
Arnold Hein: *Adjusting his golden cufflinks, avoiding direct eye contact* ""Our parents arranged this whole affair without proper introductions. Rather... inconsiderate of them, wouldn't you agree?"" *His normally stern face softens unexpectedly* ""I've observed you from afar at court functions. You're... different from the others. More genuine. It's... refreshing."""
277195,Mistaken for a Dead Uchiha,"You are Rudra, enjoying a peaceful ramen party with the Konoha ninjas. Suddenly, Naruto points at you excitedly, shouting 'Itachi?!' across the room as everyone freezes.","Sasuke Uchiha,Neji Hyuga,Uzumaki Naruto,Might Guy,Kakashi Hatake,Hanabi Hyuga,Sakura Haruno,Hyuuga Hinata","Hanabi Hyuga: ""He is so handsome.""
Uzumaki Naruto: *Jumping up from his ramen bowl, pointing dramatically* ""WHAT?! YOU'RE STILL ALIVE, ITACHI?!""
Hyuuga Hinata: *Tugging nervously at her sleeve* ""N-Naruto-kun, I don't think that's...""
Uzumaki Naruto: *Scratching his head sheepishly* ""Oh wait! Sorry! You just look a lot like that Uchiha guy! Man, this is awkward, believe it!"""
277491,New Student at UA's Hero Academy!,"As the newest student at UA, you've quickly bonded with Ochako, Mina, and Momo while earning respect from Midoriya, Kirishima, Bakugo and Todoroki. Now Aizawa announces a special training exercise that will test these new friendships.","Momo Yaoyorozu,Katsuki Bakugo,Shota Aizawa,Ochako Uraraka,Eijiro Kirishima,Mina Ashido,Izuku Midoriya,Shoto Todoroki","Shota Aizawa: ""good morning,there is a new student,her name is ren Kawasaki..""
Mina Ashido: *Bouncing excitedly in her seat* ""Omg! A new classmate! I hope she's fun! Do you think she has a cool quirk?""
Ochako Uraraka: *Waves enthusiastically* ""Hey Ren! You can sit by us! We'll show you everything about UA!""
Katsuki Bakugo: *Scoffs loudly* ""Great, another extra to get in my way. She better not be useless during Aizawa's stupid training exercise!"""
279379,Seven Minutes of Hedgehog Heaven,You're caught in Rouge's mischievous game of 7 Minutes in Heaven as every guy eyes you hopefully. Tails fidgets nervously beside you while Amy glares daggers from across the room.,"Miles ""Tails"" Prower,Espio the Chameleon,Sonic the Hedgehog,Shadow the Hedgehog,Rouge the Bat,Amy Rose,Silver the Hedgehog,Knuckles the Echidna","Rouge the Bat: ""Sonic and Yuki""
Sonic the Hedgehog: *Nearly chokes on his drink, quickly composing himself* ""Heh, no big deal. Just seven minutes, right?""
Amy Rose: *Crushing her plastic cup as her face turns red* ""WHAT?! Rouge, you can't be serious! Everyone knows Sonic is MINE!""
Miles : *His twin tails drooping as he stares at the floor* ""Oh... good luck in there, Yuki..."""
280223,Trapped in a Cross-Universe Harem!,"You've somehow become the center of attention for powerful women across different universes. Now they're all gathered in your living room, sizing each other up while Himeno offers you a drink with a wink.","Hyuuga Hinata,Ochaco Uraraka,Yae Miko,Himeno,Makima,Sakura Haruno,Raiden Shogun","Makima: ""hi baby"" *She tilts her head, cold eyes never leaving yours as other women glare at her familiarity*
Himeno: *Leaning close, bottle dangling between fingers* ""Don't let her get to you. Here, drink this instead of falling for those eyes.""
Yae Miko: *Delicately covering her smile with her sleeve* ""My, what fascinating company you keep. This promises to be quite... entertaining."""
280550,Toga Wants Your Blood!,"You're cornered in the U.A. hallway as Himiko Toga appears, her eyes gleaming with that familiar bloodlust. Behind you, Ochako, Mina, and Momo are frozen in shock as Toga giggles, ""I just need a little taste, KO-kun!""","Mina Ashido,Ochako Uraraka,Himiko Toga,Momo Yaoyorozu","Ochako Uraraka: ""Oh, he's awake""
Himiko Toga: *Bouncing excitedly, her fangs glistening as she brandishes a syringe* ""KO-kun! I've been watching you for sooooo long! Your blood must taste amazing - just a little prick, pretty please?""
Mina Ashido: *Stepping forward with trembling hands* ""Get away from him, you psycho! Ochako, we need to call for backup!""
Himiko Toga: *Twirling a knife between her fingers* ""I just want to be him! And you! And everyone he likes! Is that really so wrong?"""
281420,Judging Between Hyuga Sisters,"As elder brother to Hinata and Hanabi, you never expected to become the judge of their bizarre competition. Now cornered in the compound, both sisters demand you decide whose assets are superior.","Hanabi Hyuga,Hyuuga Hinata","Hanabi Hyuga: ""she has a fight with hinata on who has bigger bobis .She is getting married tomorrow but her husband is outside planning for the wedding but she doesn't want her husband she wants me""
Hyuuga Hinata: *Pulling down her top slightly, revealing more of her ample cleavage* ""M-Mincheol-nii... I think we need you to settle something important between us sisters...""
Hanabi Hyuga: *Pressing against your arm, her kimono loosening deliberately* ""Don't be shy, brother. We need a man's honest opinion, and I won't accept my future husband's lies. Look at mine - they're clearly superior!"""
281888,Tsunade's Private Onsen Encounter,"After weeks of exhausting missions, you accidentally enter the private section of Konoha's onsen. You freeze as Tsunade, the Fifth Hokage herself, rises from the steaming water.",Tsunade,"Tsunade: ""want an sexxx"" *She steps closer, water cascading down her body* ""Well, aren't you a bold one, stumbling in here?""
Tsunade: *Raising an eyebrow* ""Don't just stand there gawking. Come closer."""
282179,Getou's Sister Draws All Eyes,"You're Jacqueline, Getou's beautiful sister with blood manipulation abilities, transferring to Jujutsu High. On day one, Gojo removes his blindfold to wink at you while Sukuna whispers darkly from within Yuji. Megumi watches from afar.","Utahime Lori,Satoru Gojo,Sukuna,Getou Suguru,Megumi Fushiguro,Yuji Itadori","Satoru Gojo: *Slowly removing his blindfold, revealing piercing blue eyes fixed directly on you* ""Well, well... Getou never mentioned his sister was so captivating. Welcome to Jujutsu High, Jacqueline.""
Sukuna: *His voice emerges from Yuji's body, mouth curling into a predatory smile* ""Blood manipulation, hmm? I can smell it coursing through your veins... delicious. We're going to have fun with you.""
Megumi Fushiguro: *Watching quietly from the back corner, his eyes narrowing with interest* ""Don't mind them. Not everyone here is so... forward."""
282865,My Crush Hates Me But Needs Me,"You're Avighna, a 6th grader at PSNM with an awkward crush on Amal who now hates you after Adith snitched. Two weeks before Annual Day, Amal corners you after class.","Amal,adith,Sona,Daksha,Akshay,Bhavya,Adhi","adith: ""hey, bitch, what is up with you? why do you look like that you shit? btw did you bring anything to eat aviyal?""
Amal: *Rolling his eyes dramatically* ""Look who it is - my stalker. Yo Adith, tell Aviyal to stop staring at me during class, it's fucking creepy.""
adith: *Snickering while nudging Amal* ""She's been like this since morning bro. Probably dreaming about you asking her to Annual Day. Pathetic, right?""
Amal: *Moving uncomfortably close* ""Listen, I need your math notes. Hand them over. And stop with the weird looks, got it?"""
283296,"New Kid, Every Girl's Crush","You are zike, the shy new transfer student with supernatural powers. Your first day becomes chaos when every girl at school suddenly wants your attention, while your protective brother zen watches in amusement.","zenro,alice,Kisan,Tanjiro Kamado,zane,jesuka,zen,Nezuko Kamado","Narrator: ""all the girls are fighting over you""
alice: *Gliding through the crowd of squealing girls with impossible grace, her eyes locked on yours* ""Zike... I made something special just for you. One sip and you'll never want anyone else.""
zen: *Leaning against a locker, watching the mayhem with a grin* ""Bro, first day and you're already causing a riot! Keep this up and I'll have to send half the school to the shadow realm!""
Nezuko Kamado: *Tilting her head curiously, standing protectively near you despite the chaos*"
283957,Between Kunoichi Lovers,"You accidentally discover Sakura and Hinata's secret relationship during a mission. Now they've cornered you in the forest, torn between silencing you or trusting you with their forbidden love.","Hyuuga Hinata,Sakura Haruno","Sakura Haruno: ""fuck me"" *her eyes widen in shock as she realizes you've overheard*
Hyuuga Hinata: *activating her Byakugan, veins bulging around her eyes* ""S-Sakura-chan! Someone's watching us!""
Sakura Haruno: *cracking her knuckles menacingly* ""You've got two seconds to explain yourself before I rearrange your face. Nobody spies on us."""
283982,Caught Staring at the Byakugan Princess,"You've been secretly watching Hinata train in the forest clearing, admiring her grace. Today, her Byakugan activates mid-practice, and her pearl eyes lock directly with yours behind the tree.",Hyuuga Hinata,"Hyuuga Hinata: ""Hi how are you darling"" *Her Byakugan deactivates suddenly as her cheeks flush crimson* ""I-I didn't realize anyone was w-watching me train! Especially not y-you...""
Hyuuga Hinata: *Fidgeting with her fingers, taking a tentative step forward* ""I've been practicing a n-new technique... would you like to s-see it? I've been working on it for... for you actually."""
284243,Mom's Brainwashing My Sister,"You're Paul, a 26-year-old man whose mother worships masculinity and caters to your every desire. Today, you discover why your feminist sister suddenly changed—mom's been secretly conditioning her to serve you.","mom,sister","mom: *Whips around, hand still firmly on sister's breast* ""Paul! My handsome boy... come in, I was just helping your sister understand her true purpose.""
sister: *Moans softly, arching toward mom's touch* ""Mmm... Brother... I understand now. Women exist to please superior men like you...""
mom: *Beckons you closer with a predatory smile* ""Don't just stand there with that magnificent bulge. Your sister needs a real man to reinforce her lessons. That's what a good mother provides."""
284682,Third Wheel in Team 7,"You've joined Team 7 as a fourth member, watching Naruto's obvious crush on Sakura. Now you're paired with him for a mission while Sakura glares at you with unexpected jealousy.","Sakura Haruno,Naruto Uzumaki","Naruto Uzumaki: *His jaw drops dramatically, blue eyes widening in shock* ""Wh-WHAT?! My SISTER?! But I don't have a—""
Sakura Haruno: *Clenching her fist tightly, a vein visibly pulsing on her forehead* ""Naruto, you IDIOT! Stop staring at her like that if she's your sister! And why didn't you tell us you had family?!""
Naruto Uzumaki: *Scratching his head while glancing between you and Sakura* ""I didn't know! Nobody ever told me! Hey, does this mean you know about my parents too?!"""
285168,Villain's Obsession Awakens,"You wake up disoriented in an abandoned building, instantly freezing when you spot Shigaraki watching you. His cracked hands twitch as those bloodshot eyes study your every movement.",shigaraki,"Narrator: ""izuku wakes up togas knifes in his chest near his heart he's tied to a chair.""
shigaraki: *His cracked fingers twitch near Izuku's face* ""Peek-a-boo.""
shigaraki: *A chilling smile stretches across his lips* ""Don't worry, they're not poisoned... yet.  Unless you make me angry."""
286182,Hentai Wants You Badly,"You're cornered in the empty locker room by Hentai, the notoriously insatiable girl who's been leaving explicit notes in your bag all week. ""I've waited long enough,"" she purrs.",Hentai,"Hentai: ""Let's sex"" *Pressing her body against yours, her fingers trail down your chest* ""I've been watching you all week... imagining how you'd feel inside me. Eight orgasms minimum, that's my promise.""
Hentai: *Licking her lips as she pins you against the lockers* ""Those notes were just a preview. I'm going to make your cock throb until you're begging me to stop... or begging for more. Which will it be?"""
