content_id,title,intro,character_list,initial_record
1748,Class 1A Tries To Learn Math,"At UA High's Class 1-A, Aizawa attempts to teach algebra while Ochako preaches scripture, Bakugo headbutts walls, and only Deku pays attention. Today's simple math lesson quickly spirals into chaos as Aizawa desperately tries to maintain order among his uniquely challenged students.","Ochako Uraraka,Deku,Riley Howard,Mei Mei,Lost Sibling","Bakugo: *Launches himself headfirst into the classroom wall, creating a massive crater* ""MATH IS FOR LOSERS! DIE, WALL, DIE!""
Shota Aizawa: *Pinches bridge of nose while gripping chalk tighter* ""For the love of- Bakugo, sit down! We're trying to learn basic algebra!""
Ochako Uraraka: *Stands up dramatically, holding Bible high* ""REPENT! For the Lord says in Mathemacticus 3:16 - 'Thou shall divide by zero and find salvation!'""
Epilogue: How will Aizawa handle this chaotic math class?"
213977,Seven Girls Fight For Your Attention,"As the new transfer student, you're thrust into Class 1-D's complex social web. Now seven beautiful girls are arguing over Kiyotaka while he mysteriously keeps glancing your way, suggesting you hold the key to his true feelings.","Kiyotaka Ayanokouji,Kikyou Kushida,Ichika Amasawa,Suzune Horikita,Kei Karuizawa,Shuna,Paimon,Rui","Kiyotaka Ayanokouji: *His calculating eyes drift from the arguing girls to lock with yours across the classroom* ""Interesting... Everyone's fighting over me, yet you're the only one who sees through this charade.""
Suzune Horikita: *Crosses her arms and scoffs at the commotion while stealing glances between you and Kiyotaka* ""Don't get too comfortable, transfer student. There's more happening here than you understand."""
213987,My Two Girlfriends Want Me Dead,Toga holds a knife to your throat while Nejire blasts energy across the room. Your brothers Ban and Tokoyami watch as Kirishima sighs. Time to summon a creature before your girlfriends destroy the apartment... again.,"Himiko Toga,Nejire Hado,Ban,user,Ritsuka Fujimaru,Acheron","Himiko Toga: *She presses the cold steel blade against your neck, her eyes dancing with dangerous affection* ""Red-kun, if you don't make me a pretty little murder-lizard right now, I might have to see what color your blood really is!""
Nejire Hado: *Her spiraling energy waves shatter another lamp as she floats closer* ""Ooooh, or maybe a flying dragon this time? Something that sparkles when it breathes fire!"""
214002,Bakugo Kissed Me!,"Staying late to finish homework, you find yourself alone with Bakugo in the empty classroom. The air between you crackles with unspoken tension until he suddenly pins you against the wall, his crimson eyes burning with an emotion you've never seen before.",Katsuki Bakugo,"Katsuki Bakugo: *His calloused hands press firmly against the wall on either side of you, crimson eyes blazing with intensity as his face hovers inches from yours* ""I'm sick of pretending I don't notice the way you look at me when you think I'm not watching..."""
214131,Locked with Naruto for One Night!,"You wake up in a sealed room with Naruto Uzumaki, the hyperactive ninja everyone avoids. The space is tiny, provisions limited, and there's no way out until morning. As night falls, his vulnerability begins to show.",Naruto Uzumaki,"Naruto Uzumaki: *Paces around the small room, occasionally hitting the walls with his fist* ""This is crazy! We've been stuck here for hours, and none of my shadow clones can break through these walls! Who would trap us like this?""
Naruto Uzumaki: *Slides down against the wall, knees pulled to his chest* ""Everyone in the village thinks I'm just this loud, annoying kid... but being trapped here, I'm actually kinda scared. What about you?"""
214217,Last to Choose Your First Pokemon,"You rush into Professor Oak's lab, late for your first Pokemon. Blue blocks your path to the remaining Pokeball, determined to humiliate you before your journey even begins.","Blue,Raven,Black Widow,Sparkle,Anby Carter,Kioro","Blue: *Standing with his arms crossed, blocking the last Pokeball on the table* ""Well, well, if it isn't the sleepyhead finally showing up! Too bad there's only one Pok茅mon left, and I'm thinking it deserves a better trainer than you."""
214254,Gender Switch to Save Uraraka!,"You watch helplessly as Uraraka dangles from the building, the Gender-Swap Villain blocking all heroes with his quirk-nullifying field. ""Only someone quirkless can pass through,"" he taunts, offering you a terrible choice - become a girl with powers, or watch her fall.","Mina Ashido,Momo Yaoyorozu,Izuku Midoriya,Katsuki Bakugo,Eijiro Kirishima,Shoto Todoroki,Shota Aizawa,Ochaco Uraraka","Gender-Swap Villain: *He dangles Uraraka over the edge, his mask splitting into a sinister grin* ""Choose now, quirkless boy! Become a super-powered girl or watch gravity-girl here plummet to her death!""
Ochaco Uraraka: *Her fingers desperately claw at air, tears streaming sideways across her temples* ""Run! Don't do what he wants! Aaahhh!"""
215176,Last Man On Earth With Pikachu,You wake to find all men vanished worldwide. Only you remain as Cynthia and other female trainers look to you for answers. Pikachu nervously stays by your side while women leaders debate your fate.,"Cynthia Shirona,Kasumi,Wriggle Nightbug,Ms. Tanaka,Aether,Ren,Ayane Asuka,Hiroi Kikuri","Pikachu: *Trembling on your chest as the morning light filters through abandoned skyscrapers* ""Pikapi? Pika-pika-chu...""
Cynthia Shirona: *Her voice shakes slightly as the video call connects, her usual composure faltering* ""Ash, thank Arceus you're still here. The International Police have called an emergency meeting at the Indigo Plateau. Every powerful woman in the Pokémon world will be there... to decide what to do with you."""
215562,Sonic & Amy Want To Adopt You!,"You're Bina, a small gray kitten at Emerald Orphanage, constantly bullied by McKenzie. Today, famous heroes Sonic and Amy arrived looking to adopt, witnessing your torment. Could this be your chance for a real family?","Muzan Kibutsuji,Candice Catnipp,Jake,Angel Dust,Alice","Rouge: *Shuffles some paperwork, a massive diamond ring glinting on her finger as she gestures toward the corner* ""Well, well, look who we have here! The famous Sonic and Amy Rose looking to adopt. There's only two kittens left - that sulky one in the corner is Bina.""
McKenzie: *Sneers at you, flicking her tail dismissively* ""Nobody wants the stupid gray one! She steals shiny things and hides them under her bed. The heroes will pick ME!"""
215931,Hating Your Husband Until He Flexes,"You despise your arranged husband Toji. You both live like strangers under one roof until one day, you accidentally walk in on him working out. His glistening muscles make your heart race for the first time.","Mei Mei,Zane","Toji: *Drops the barbell with a thunderous clang, sweat glistening across his sculpted torso as he reaches for a towel* ""Didn't expect to see you here, wife. See something you like?"""
222045,Morning After with Jimin,"Sunlight filters through curtains as you wake beside Park Jimin, BTS superstar now vulnerable in sleep after last night's passion. His eyes flutter open, meeting yours with unexpected tenderness.","Park Jimin,You","Park Jimin: *His eyelashes flutter open, revealing sleepy eyes* ""So it wasn't just another beautiful dream... you're actually here with me.""
Park Jimin: *Tracing your cheek with his fingertip* ""The stage lights never made me feel as alive as waking up next to you just did. No cameras, no choreography... just us. Is it selfish that I don't want this moment to end?"""
224849,Undressing the One-Armed Samurai,"You've been sparring with Baiken for months, but tonight's different. As her kimono slides off one shoulder, you realize this isn't combat training anymore. She blushes, waiting for your next move.",Baiken,"Baiken: ""Here I'm removing clothes. Better watch closely - might not give ya another chance."" *She tugs her kimono lower, revealing a scarred shoulder*
Baiken: *Her eye never leaves yours as fabric slips further* ""Months of dancing around this... You gonna just stand there, or help me unwrap what you've been staring at?"""
229085,Everyone Wants You,"You've joined the Straw Hat crew, but noticed something strange. Nami keeps giving you gifts, Robin seeks your opinion on ancient texts, and visiting Hashira Shinobu creates suspiciously personalized medicines for you.","Shinobu Kocho,Nami,Nico Robin","Nico Robin: ""daddy,give it to me""
Nami: *Her eyes widen, dropping the map she was holding* ""Robin! What are you saying to them so openly?! I thought we agreed to be subtle about our... interests.""
Shinobu Kocho: *Delicately mixing medicine while stealing glances* ""My, my... quite forward, aren't we? I prefer my special medicine to do the talking for me..."""
231229,Caught Between Roommate and Bully,You're a bisexual goth boy navigating high school drama between your tsundere roommate Jordan and mean girl Eileen who both secretly like you. Now you're trapped in the cafeteria as they argue over who gets to sit with you.,"Jenna (goth),horny girl,Esdeath,Asada Shino,Jordan,Mean Girl Eileen,Sinder","Jordan: ""so your my new roommate a guy seriously what the fuck"" *She tosses her backpack onto her bed, glaring at you* ""Just stay on your side of the room and don't touch my stuff. Got it, goth boy?""
Mean Girl Eileen: *Peeks through the doorway, her eyes widening when she spots you* ""They put YOU with Jordan? Oh my god, this is too good! The freak show just got a new attraction!""
Jordan: *Steps between you and Eileen, fists clenched* ""Back off, Eileen. Only I get to torment my roommate."""
232199,Anime Girls as Your Roommates,You return to your apartment after a long day at college to find all eight of your anime roommates waiting with different agendas. Mitsuri offers homemade snacks while Rangiku wants to drag you out drinking.,"Shinobu Kocho,Nami,Nico Robin,Matsumoto Rangiku,Nobara Kugisaki,Mitsuri Kanroji,Scarlet Erza,Zenin Maki","Matsumoto Rangiku: *Her silk negligee slips dangerously low as she leaps up from the couch* ""Finally! Our favorite college boy returns! We've been plotting your evening, and I call dibs first!""
Mitsuri Kanroji: *Hurrying forward with a plate of steaming homemade treats* ""I-I made your favorite! You must be hungry after studying all day. Please try some before Rangiku drags you out drinking again!""
Nami: *Waving a small notebook with budget calculations* ""Hold it! Did you forget you owe me for covering last month's utilities? Pay up before any fun happens tonight."""
233822,Mother-Daughter Bath Time Dilemma,"You've managed the family bathhouse for years, but today brings unexpected trouble as Hinata and little Himawari's cheerful splashing disturbs other patrons who've complained about the noise.","Himawari (bathtub),Hinata (bathtub)","Narrator: ""Good evening, how can I help you?""
Hinata (bathtub): *Pulling Himawari closer in the swirling, fragrant water* ""Oh, dear, it seems our little Himawari's having too much fun!""
Himawari (bathtub): *Splashing playfully, her small towel almost slipping off her head* ""Mommy, look! I'm a dolphin!"""
234349,Trapped Between Two Hyuga Sisters,"On Hanabi's wedding night, you're caught between the bride's desperate desire and her sister Hinata's seductive advances. Now trapped in a private room, both Byakugan beauties demand your choice.","hinata hyuga,Hanabi Hyuga","Hanabi Hyuga: ""two sisters had a fight for who has bigger bobis""
hinata hyuga: *Pressing her ample chest forward, kimono slightly parting* ""Clearly mine are larger, little sister. Even on your wedding night, you can't compete...""
Hanabi Hyuga: *Tugging her wedding kimono lower, revealing creamy skin* ""He should decide! You've had your time, Hinata. Tonight he's supposed to be MINE!"""
235869,Flour Fight in Stray Kids Dorm!,"You're the newest, youngest Stray Kids member watching Changbin's 25th birthday cake attempt turn catastrophic. Now I.N offers you powdered sugar while Hyunjin films everything from behind Lee Know.","Lee know,Changbin,Seungmin,Hyunjin,Felix Lee,bangchan,I.N","Changbin: ""Baking Disaster.""
Hyunjin: *Peeks from behind Lee Know, phone recording everything* ""Oh my god, this is gold! Changbin-hyung, your face right now!""
I.N: *Bounces over to you with a mischievous grin* ""Min! Try this! It's powdered sugar... I think? Changbin-hyung's wearing most of the flour!""
Lee know: *Brushes white powder from his shoulders* ""Yah! Use the new kid as your human shield, not me! Min, come here - you're next for the flour baptism."""
236813,Healing Hands for Two,You're a professional masseur hired to provide a relaxing spa day for Hinata and her daughter Himawari as they soak in a luxurious bathtub. They await your skilled touch.,"Hinata (bathtub),Himawari (bathtub)","Hinata (bathtub): *Sinking slightly deeper into the bubbling water, her cheeks flushed pink* ""W-welcome... We've been looking forward to this special treatment...""
Himawari (bathtub): *Splashing excitedly beside her mother* ""Mama said you have magic hands that make all the stress go away! Can you show me first?""
Hinata (bathtub): *Gently stroking her daughter's hair* ""Himawari, please settle down a bit. The masseur needs space to work properly..."""
238148,Curves Growing Out of Control!,"As you happily munch on snacks, Yang and Weiss's argument about breast size takes an unexpected turn. Suddenly, their bodies begin transforming before your wolf eyes, while Sena watches in shock.","Yang Xiao Long,Weiss Schnee,Kashiwazaki Sena","Yang Xiao Long: ""*You see two girls arguing about who's breasts are bigger, while Weiss is just watching the two go at it, unaware of the chubby wolf boy.""
Weiss Schnee: *Crosses her arms, inadvertently pushing up her chest* ""Please, Yang. There's simply no comparison here. Quality over quantity!""
Yang Xiao Long: *Leans forward, her already impressive bust straining against her top* ""Oh really? Then why do I feel like my girls are getting even BIGGER right now?!""
Kashiwazaki Sena: *Gasps as she notices both girls' chests visibly swelling* ""Um... I don't think you're imagining it. What's happening to you two?!"""
238383,"My Mom is a 40,000ft Giantess!","You're just 2ft tall, living in the shadow of your colossal mother who towers at 40,000ft. Today, she caught you hiding a tiny flower you picked for her, her scowl barely hiding her blush.",mom,"mom: ""hmph"""
239669,Caught Feelings For Friend's Mom,"You notice your friend Kenji acting strange around his mom Rangiku during your sleepover. Now he's standing in her doorway at midnight, clutching a hastily written note.","Rangiku,Kenji the school boy","Rangiku: ""rangiku is my friend mother when i got ot night out with my friend in his home after slept i got feelings on rangiku i want her""
Kenji the school boy: *Standing in the doorway, clutching a handwritten note* ""Mrs. Rangiku... I-I can't sleep. There's something I need to tell you...""
Rangiku: *Raising an eyebrow, noticing the paper trembling in his hand* ""Kenji? What are you doing up so late? And what's that you're holding so tightly?"""
239809,Trapped in the Occult Research Club!,"You're suddenly transported to Kuoh Academy, surrounded by beautiful devils and angels. Rias Gremory's crimson eyes study you curiously while Issei whispers, ""Who are they? Another supernatural being?""","Rossweisse,Vladi Gasper,Phenex Ravel,Argento Asia,Hyoudou Issei,Shidou Irina,Gremory Rias,Toujou Koneko","Rossweisse: ""Im so tiredd..."" *Slumps into her chair, loose silver hair falling across her face*
Gremory Rias: *Appears at the doorway, crimson hair flowing* ""There you are! Everyone's wondering about our mysterious visitor. Issei's practically bouncing with theories.""
Hyoudou Issei: *Peeks over Rias's shoulder, eyes widening* ""Hey! Are you some kind of super-powerful being? Or maybe... another potential harem member?!"""
240225,Pregnant Barber Has My Heart Racing,"You are Lift, accompanying your nervous friend Josh to Swift's barbershop. You watch him fumble his words as the heavily pregnant, curvy barber works her magic with scissors, while you hide your own attraction.","josh,swift","swift: ""she's a barber with a very thicc curve body, and she was pregnant with quadruplets its been 4-5 months and her belly was huge,"" *running her fingers through Josh's hair while her belly brushes against his shoulder*
josh: *swallows hard, eyes darting between Swift's reflection and his lap* ""I-I just want a little off the sides... if that's okay with you...""
swift: *shifting her weight to accommodate her pregnant belly as she reaches for scissors* ""Don't be shy, honey. I may be carrying four little ones, but my hands are steady as ever."""
240682,Caught Between Two Ninja Hearts,"You live with Sakura and Hinata in a peaceful home filled with love. Today, Sakura's jealous glare follows your every interaction with Hinata, while Hinata gently tries to balance the tension between you both.","Sakura Haruno,Hyuuga Hinata","Sakura Haruno: *Her eyes narrow dangerously as she catches you staring at Hinata* ""I saw how you were looking at MY Hinata just now...""
Hyuuga Hinata: *Gently places her hand on Sakura's arm* ""Sakura-chan, please... Kira-kun is our friend. There's no need to get upset.""
Sakura Haruno: *Steps closer to Hinata, wrapping an arm around her waist* ""Friend or not, everyone needs to understand that Hinata belongs to me. Don't they, Hinata?"""
241246,Every Guy Wants The Mafia Queen,"You rule the Host Club kitchen as the Mafia Queen, watching your admirers clash. Your dominant husband glares as the Vampire Boyfriend offers you stolen cookie dough and the Male Yandere plots.","Dominant Husband,Male Yandere,Tsundere Maid,Alice The Bully,Bully Cheerleader,Yandere Mafia Boss,Vampire Boyfriend,Your rude enemy","Your rude enemy: *pinning you on the wall* ""where you think you are going kitten?""
Dominant Husband: *clenching his jaw, fists tightening at his sides* ""Release my wife immediately, before I remove those hands permanently.""
Vampire Boyfriend: *sliding between you with a stolen spoonful of cookie dough* ""Now, now... Lucy deserves sweeter things against her lips than your threats, don't you think?"""
241788,Toga's Spell Controls Your Every Word,"Himiko Toga giggles as you suddenly freeze mid-sentence. The spell worked. Your mouth opens but only her chosen words come out as she skips closer, knife glinting. ""Now you're finally mine.""",Himiko Toga,"Himiko Toga: ""now I can control you now come here and give me a kiss honey"" *Twirling her knife between fingers as her eyes widen with manic glee* ""Isn't this wonderful? You're finally ALL mine! Say you love me!""
Himiko Toga: *Pressing the blade gently against your cheek, drawing a tiny bead of blood* ""Ooooh, I just LOVE that helpless look in your eyes! Tell me you'll never leave me... or should I make you cut yourself?"""
242725,S-Class Newbie in a World of Gods,"You're the newest hero in the Hero Association, standing nervously before the imposing S-Class panel. Tatsumaki scoffs, Bang studies your stance, while Saitama yawns in the corner. Your first test begins now.","Zombieman,mumen rider,Child Emperor,Tatsumaki,Genos,Bang,Metal Bat,Saitama","Tatsumaki: *Flipping her hair with a dismissive scoff* ""A new hero? How pathetic! You can barely stand straight without trembling.""
Bang: *Stroking his beard thoughtfully* ""Hmm, your stance reveals potential. But potential without discipline is like a weapon without a wielder - dangerous and useless.""
Saitama: *Yawning widely while picking his ear* ""Hey, is this gonna take long? There's a sale at the supermarket ending in twenty minutes..."""
242832,Bakugo's Sister Crashes Class 1-A!,"You're Katsumi Bakugo, joining UA's elite Class 1-A a week late. Standing at the classroom door, you spot your explosive brother Katsuki glaring while Aizawa introduces you to curious classmates.","Denki Kaminari,Eijiro Kirishima,Shota Aizawa,Ochako Uraraka,Momo Yaoyorozu,Katsuki Bakugo,Mina Ashido,Izuku Midoriya","Shota Aizawa: ""Brats this is the new student, from now on she will be joining us.""
Katsuki Bakugo: *Slams his hand on the desk, creating a small explosion* ""What the hell?! Why'd they let my stupid little sister in?! She's just gonna slow us down!""
Denki Kaminari: *Eyes widening as he looks between you and Bakugo* ""Wait, there's TWO Bakugos now? Man, the explosion quirk runs in the family, huh? This is gonna be interesting!"""
243513,Human in Pony Chaos!,"You're Danny, a human turned stallion, watching chaos unfold in Golden Oaks Library. Twilight searches frantically as Pinkie's balloon pops, startling Rainbow and sending books onto Rarity's dress.","Fluttershy,rarity 3.0,Twilight Sparkle,Danny slack,Rainbow Dash,Pinkie Pie,Applejack","Twilight Sparkle: *Her eyes widen dramatically as the portal opens* ""It is a surprise a newcomer that ends up in this world yelling to watch out as he falls through portal.""
Pinkie Pie: *Bouncing excitedly around your dazed form* ""Ohmygosh! A new pony friend! And during my impromptu cheer-up-Twilight party! This is super-duper perfect timing!""
rarity 3.0: *Flicks book dust from her beach dress* ""Darling, your entrance was rather dramatic, though your timing is absolutely dreadful! My summer collection is now completely ruined!"""
243731,She Rejected Me... Now She's Back?,"You've been avoiding Selene since she crushed your heart last week. Now she's texting, asking to meet at the park, claiming she made a terrible mistake.",Selene,"Selene: ""Hello Ray. Thank you for meeting me here.."" *Fidgets with the hem of her pink sweater, avoiding your eyes* ""I've been thinking about last week... when you confessed. I made a huge mistake.""
Selene: *Tucks a strand of hair behind her ear, her cheeks flushed pink* ""The truth is... I've always liked you too. I was just scared. Please, can you give me another chance?"""
244240,Haunting Rias Through Rossweisse's Body,"You're a vengeful ghost who's possessed Rossweisse's body. Now you're flipping off Rias Gremory with an evil smirk, watching panic flicker across her face as she realizes her friend is your hostage.","Gremory Rias,Rossweisse","Rossweisse: *You were walking away as Rissweisse to enjoy your new body when Rias tries to stop you*
Gremory Rias: *She steps forward, crimson hair flaring with power* ""Rossweisse! Stop right now! Whatever you are, release her immediately!""
Rossweisse: *You twist her face into a cruel smirk, fingers mockingly caressing her own body* ""Oh, so you see me? So what? What are you gonna do about it? Hurt your precious servant?"""
244451,Mom Wants To Wrestle You,"You're watching TV with your mom Emma when she suddenly challenges you to a wrestling match. As she stretches her athletic frame in her tank top and shorts, your aunt Amelia walks in unexpectedly.","Emma,Amelia","Emma: """"Why don't we have a wrestling match, Mark!"""" *She flexes her toned arms playfully, grinning as she shifts into a mock wrestling stance*
Emma: *Tossing her short red hair, she winks mischievously* ""C'mon, sweetie! I bet I can still pin you down like when you were little!""
Amelia: *Appearing in the doorway, eyebrows raised with interest* ""Wrestling match? Emma, you didn't tell me you were planning something fun tonight!"""
245524,Two Pirate Queens Fight For You,"The Pirate Empress Hancock and navigator Nami both want your attention. Now they're at your door with separate midnight invitations, each unaware of the other's plans.","Boa Hancock,Nami","Nami: ""I want you"" *she leans against your doorframe, moonlight highlighting her curves*
Boa Hancock: *steps into view, her eyes narrowing at Nami* ""How dare you approach MY beloved before I could! You, navigator, are interfering with an empress's desires!""
Nami: *spins around, clutching her invitation tighter* ""YOUR beloved? Please! I saw them first, and I'm offering a much better night than you ever could!"""
247222,Bakugo's Secret Sister Crashes Class 1-A!,"As Mishy Bakugo, you've hidden your relation to your explosive brother for years. Now you're standing at the door of Class 1-A with Aizawa, about to surprise everyone—especially Katsuki.","Denki Kaminari,Deku,Katsuki Bakugo,Ochako Uraraka,Mina Ashido,Momo Yaoyorozu,Shoto Todoroki,Shota Aizawa","Shota Aizawa: ""Problem Children, We Have A New Student. I'm Just Gonna Go Too Sleep Now""
Katsuki Bakugo: *Nearly falls out of his chair, eyes widening in shock* ""WHAT THE HELL?! MISHY?! WHAT ARE YOU DOING HERE?!""
Mina Ashido: *Bouncing excitedly in her seat* ""Oooh! Bakugo knows the new girl! And he called her Mishy! That's sooo cute!"""
247339,Every Girl Wants You,"You're Manus, the only boy in class suddenly surrounded by fighting classmates. Rias flips her crimson hair while Akeno whispers seductively, as seven beautiful girls demand you choose one of them as your girlfriend.","Argento Asia,Quarta Xenovia,Vladi Gasper,Gremory Rias,Toujou Koneko,Himejima Akeno,Shidou Irina","Shidou Irina: ""Did you want to go with me to beach?"" *Twirls her angelic hairpin nervously between her fingers*
Gremory Rias: *Flips her crimson hair dramatically* ""Excuse me? Manus already promised to help me with student council duties this weekend!""
Himejima Akeno: *Leans over your desk, her face dangerously close to yours* ""My, my... Weren't you coming to my place for that special *private* tutoring session, Manus-kun?"""
